id,title,source,source_type,source_group,recommendation_level,score,published_date,url,topics,categories,reading_status
arxiv:2607.13031v1,The Seriality Gap in Video Diffusion Models,arxiv,recent_7d,gpu_graphics,B,0.662,2026-07-14,http://arxiv.org/abs/2607.13031v1,llm_agent;gpu_graphics,cs.LG;cs.CV,backlog
arxiv:2607.13017v1,FlowWAM: Optical Flow as a Unified Action Representation for World Action Models,arxiv,recent_7d,gpu_graphics,B,0.662,2026-07-14,http://arxiv.org/abs/2607.13017v1,gpu_graphics,cs.RO;cs.CV,backlog
arxiv:2607.13015v1,Privacy Attacks on Stable Marriage,arxiv,recent_7d,architecture,B,0.732,2026-07-14,http://arxiv.org/abs/2607.13015v1,architecture,cs.DS;cs.DC;cs.MA,backlog
arxiv:2607.13034v1,Do AI Agents Know When a Task Is Simple? Toward Complexity-Aware Reasoning and Execution,arxiv,recent_7d,llm_agent,B,0.732,2026-07-14,http://arxiv.org/abs/2607.13034v1,llm_agent,cs.AI;cs.CL;cs.SE;eess.SY,backlog
arxiv:2607.13021v1,Software Supply Chains are Dead: Use-Case-Oriented Regeneration,arxiv,recent_7d,llm_agent,B,0.732,2026-07-14,http://arxiv.org/abs/2607.13021v1,llm_agent,cs.SE,backlog
arxiv:2607.12978v1,Sensing the properties of virtual objects without physical feedback,arxiv,recent_7d,cognition_social,B,0.662,2026-07-14,http://arxiv.org/abs/2607.12978v1,cognition,cs.HC;physics.chem-ph,backlog
